text,old_intent,is_diff,new_intent,is_diff_relabel,relabel_intent
hãy đặt huỳnh quang 2 ở mức 1,smart.home.set.level,True,smart.home.set.percentage,0,smart.home.set.level
mình muốn bật đèn âm trần 4,smart.home.set.level,True,smart.home.device.onoff,True,smart.home.device.onoff
thay đổi bóng tuýp thứ 4 quầy lễ tân 3 mức 2,smart.home.set.level,True,smart.home.decrease.level,0,smart.home.set.level
bóng đứng 4 công ty mức 1,smart.home.set.level,True,smart.home.decrease.level,0,smart.home.set.level
chỉnh rèm đôi cổng chính số 4,smart.home.set.level,True,smart.home.increase.level,0,smart.home.set.level
chuyển đèn hắt tường thứ 4 lên bạn ơi,smart.home.set.level,True,smart.home.increase.level,0,smart.home.set.level
chỉnh bóng thờ 4 phòng nam hộ tôi nhé,smart.home.set.level,True,smart.home.decrease.percentage,0,smart.home.set.level
đặt hộ tớ cái cột đèn 1 4 ở phòng ngủ con trai 3 ở mức 1 nào cậu,smart.home.set.level,0,smart.home.set.level,0,smart.home.set.level
bóng hắt tường phòng trẻ em ở mức 4,smart.home.set.level,0,smart.home.set.level,0,smart.home.set.level
tôi cần đổi bình nóng lạnh 4 số 4,smart.home.set.level,True,smart.home.set.color,0,smart.home.set.level
chỉnh cửa cuốn ở phòng là,smart.home.set.level,0,smart.home.set.level,0,smart.home.set.level
đèn cảnh phòng tắm ở mức 4,smart.home.set.level,0,smart.home.set.level,0,smart.home.set.level
hãy bật vô tuyến thứ 3 ở mức 2,smart.home.set.level,True,smart.home.set.percentage,0,smart.home.set.level
cài đặt bóng treo tường thứ 4 phòng vệ sinh 3 số 3,smart.home.set.level,True,smart.home.set.percentage,0,smart.home.set.level
van tưới xố 3,smart.home.set.level,True,,0,smart.home.set.level
cài đặt hắt tường 1 ở phòng lễ tân 1,smart.home.set.level,True,smart.home.set.percentage,0,smart.home.set.level
nice giúp mình điều chỉnh thiết bị là quạt hút mùi thứ 1 ở phòng nhá,smart.home.set.level,True,smart.home.check.status,0,smart.home.set.level
mình muốn thay đổi màn cửa đơn,smart.home.set.level,True,smart.home.check.status,0,smart.home.set.level
van nước phòng giặt ủi 5 mức 3,smart.home.set.level,True,smart.home.decrease.level,0,smart.home.set.level
chào bạn bạn giúp mình đặt thiết bị trong sảnh được không,smart.home.set.level,True,smart.home.increase.level,0,smart.home.set.level
cài đặt bóng led 4 phòng chánh lên mức 2,smart.home.set.level,True,smart.home.increase.level,0,smart.home.set.level
chuyển công tắc cổng chính 2 hộ tôi nhé,smart.home.set.level,True,smart.home.decrease.percentage,0,smart.home.set.level
thay cho mình đèn ốp tường 2 trong phòng thu bạn ơi,smart.home.set.level,True,smart.home.check.status,0,smart.home.set.level
chuyển quạt 4 ở mức 4 được không,smart.home.set.level,True,smart.home.set.percentage,0,smart.home.set.level
tôi cần thay đổi bóng kiểng thứ 3 số 5,smart.home.set.level,True,smart.home.set.color,0,smart.home.set.level
hạ xuống độ sáng bóng sợi đốt 4 xuống 9 phần trăm,smart.home.decrease.percentage,0,smart.home.decrease.percentage,0,smart.home.decrease.percentage
trong phòng ông bà 2 hãy giảm đèn bàn 4 xuống 5 phần trăm,smart.home.decrease.percentage,0,smart.home.decrease.percentage,0,smart.home.decrease.percentage
tôi cần hạ ốp trần 2 lầu trệt 9 đi 19 phần trăm,smart.home.decrease.percentage,0,smart.home.decrease.percentage,0,smart.home.decrease.percentage
cho cái đèn học thứ 4 xuống 8 phần trăm hộ tôi với,smart.home.decrease.percentage,0,smart.home.decrease.percentage,0,smart.home.decrease.percentage
giảm bóng thờ thứ 4 về 11 phần trăm ở phòng sinh hoạt chung,smart.home.decrease.percentage,0,smart.home.decrease.percentage,0,smart.home.decrease.percentage
huỳnh quang thứ 2 ở phòng em nhỏ về 12 phần trăm,smart.home.decrease.percentage,True,smart.home.set.percentage,0,smart.home.decrease.percentage
bạn giảm cho mình bóng rủ 3 được không mình thấy hơi bị sáng quá,smart.home.decrease.percentage,0,smart.home.decrease.percentage,True,smart.home.decrease.level
tôi đang cần giảm mức độ đèn bóng trần phòng,smart.home.decrease.percentage,True,smart.home.decrease.level,True,smart.home.decrease.level
nút nhấn 2 sân sau nên được giảm đi xuống mức 38 phần trăm,smart.home.decrease.percentage,0,smart.home.decrease.percentage,0,smart.home.decrease.percentage
bạn giúp mình giảm kịch bản đi 21 phần trăm được không mình cảm ơn,smart.home.decrease.percentage,0,smart.home.decrease.percentage,0,smart.home.decrease.percentage
hãy giảm tivi 3 trong phòng sếp xuống 16 phần trăm,smart.home.decrease.percentage,0,smart.home.decrease.percentage,0,smart.home.decrease.percentage
giảm thiết bị vô tuyến thứ 3 cho tôi với,smart.home.decrease.percentage,0,smart.home.decrease.percentage,True,smart.home.decrease.level
tôi cần giảm đi đèn học tầng trệt 10 đi 27 phần trăm,smart.home.decrease.percentage,0,smart.home.decrease.percentage,0,smart.home.decrease.percentage
giảm đèn vách thứ 4 về 30 phần trăm ở trong vườn,smart.home.decrease.percentage,0,smart.home.decrease.percentage,0,smart.home.decrease.percentage
giảm cho mình loa thứ 3 ở phòng nghỉ ngơi 4 xuống 29 phần trăm nhé,smart.home.decrease.percentage,0,smart.home.decrease.percentage,0,smart.home.decrease.percentage
cho mình giảm bóng treo tường thứ 2 ở công ty mức 22 phần trăm,smart.home.decrease.percentage,0,smart.home.decrease.percentage,0,smart.home.decrease.percentage
bạn giảm cho mình rgb được không mình thấy hơi bị sáng quá,smart.home.decrease.percentage,0,smart.home.decrease.percentage,True,smart.home.decrease.level
cho mình giảm đèn hắt trần với,smart.home.decrease.percentage,0,smart.home.decrease.percentage,True,smart.home.decrease.level
device đèn sân room tủ giữ đồ phần trăm 9 phần trăm,smart.home.decrease.percentage,0,smart.home.decrease.percentage,0,smart.home.decrease.percentage
điện ở cơ quan về 8 phần trăm,smart.home.decrease.percentage,True,smart.home.set.percentage,0,smart.home.decrease.percentage
giảm thiết bị bóng tròn cho tôi với,smart.home.decrease.percentage,0,smart.home.decrease.percentage,True,smart.home.decrease.level
giảm hộ mình nút ấn 4 xuống 3 phần trăm nhé,smart.home.decrease.percentage,0,smart.home.decrease.percentage,0,smart.home.decrease.percentage
hạ xuống độ sáng bóng huỳnh quang 1 xuống 22 phần trăm,smart.home.decrease.percentage,0,smart.home.decrease.percentage,0,smart.home.decrease.percentage
giảm hộ mình đèn vách xuống 5 phần trăm nhé,smart.home.decrease.percentage,0,smart.home.decrease.percentage,0,smart.home.decrease.percentage
giảm giúp tôi độ sáng đèn vườn ngoài phòng dành cho nữ 4 xuống với,smart.home.decrease.percentage,0,smart.home.decrease.percentage,True,smart.home.decrease.level
bạn giúp mình giảm led 3 đi 23 phần trăm được không mình cảm ơn,smart.home.decrease.percentage,0,smart.home.decrease.percentage,0,smart.home.decrease.percentage
giảm giúp mình màn cửa đơn thứ 3 tại phòng chính 4 xuống 19 phần trăm nhé,smart.home.decrease.percentage,0,smart.home.decrease.percentage,0,smart.home.decrease.percentage
giảm hộ anh bóng treo tường ở phòng họp gia đình 5 21 phần trăm,smart.home.decrease.percentage,0,smart.home.decrease.percentage,0,smart.home.decrease.percentage
giảm giúp mình bóng thả 3 tại phòng chờ xuống 14 phần trăm nhé,smart.home.decrease.percentage,0,smart.home.decrease.percentage,0,smart.home.decrease.percentage
mình cần sự trợ giúp trong việc giảm đèn trang trí 2,smart.home.decrease.percentage,True,smart.home.decrease.level,True,smart.home.decrease.level
giảm hộ mình van nước thứ 1 xuống 27 phần trăm nhé,smart.home.decrease.percentage,0,smart.home.decrease.percentage,0,smart.home.decrease.percentage
giảm độ sáng nút ấn thứ 4 ấy trợ lý ảo nó sáng quá,smart.home.decrease.percentage,0,smart.home.decrease.percentage,True,smart.home.decrease.level
giảm mành thứ 2 đầu hè xuống 21 phần trăm hộ tôi với,smart.home.decrease.percentage,0,smart.home.decrease.percentage,0,smart.home.decrease.percentage
giảm động cơ 4 về 27 phần trăm ở phòng nam,smart.home.decrease.percentage,0,smart.home.decrease.percentage,0,smart.home.decrease.percentage
hãy giảm huỳnh quang thứ 3 trong tiền sảnh 5 xuống 29 phần trăm,smart.home.decrease.percentage,0,smart.home.decrease.percentage,0,smart.home.decrease.percentage
bạn giảm cho mình quạt thông gió được không mình thấy hơi bị sáng quá,smart.home.decrease.percentage,0,smart.home.decrease.percentage,True,smart.home.decrease.level
device rèm ngang thứ 2 room cầu thang phần trăm 22 phần trăm,smart.home.decrease.percentage,0,smart.home.decrease.percentage,0,smart.home.decrease.percentage
đèn tường thứ 2 cơ quan nên được hạ xuống mức 11 phần trăm,smart.home.decrease.percentage,0,smart.home.decrease.percentage,0,smart.home.decrease.percentage
giảm hắt tường thứ 3 về 26 phần trăm ở trong phòng sếp,smart.home.decrease.percentage,0,smart.home.decrease.percentage,0,smart.home.decrease.percentage
giảm hộ anh đèn sưởi 1 ở phòng thực hành 2 2 phần trăm,smart.home.decrease.percentage,0,smart.home.decrease.percentage,0,smart.home.decrease.percentage
device bóng treo tường thứ 2 room phòng giặt ủi phần trăm 21 phần trăm,smart.home.decrease.percentage,0,smart.home.decrease.percentage,0,smart.home.decrease.percentage
bạn giảm cho mình âm thanh đa vùng thứ 1 được không mình thấy hơi bị sáng quá,smart.home.decrease.percentage,0,smart.home.decrease.percentage,True,smart.home.decrease.level
giảm bóng huỳnh quang 3 ở phòng ngủ các con xuống 5 phần trăm cho mình với,smart.home.decrease.percentage,0,smart.home.decrease.percentage,0,smart.home.decrease.percentage
tôi cần giảm đi mành cuốn 3 tầng thượng 3 đi 24 phần trăm,smart.home.decrease.percentage,0,smart.home.decrease.percentage,0,smart.home.decrease.percentage
thôi vào việc nhé màn cửa nhìn ngứa mắt quá giảm cho anh xuống 9 phần trăm nhé à cái loa nhé,smart.home.decrease.percentage,0,smart.home.decrease.percentage,0,smart.home.decrease.percentage
giảm giúp tôi độ sáng rèm ngang 3 ngoài phòng thí nghiệm xuống với,smart.home.decrease.percentage,0,smart.home.decrease.percentage,True,smart.home.decrease.level
giảm độ sáng bóng sưởi thứ 4 ấy trợ lý ảo nó sáng quá,smart.home.decrease.percentage,0,smart.home.decrease.percentage,True,smart.home.decrease.level
giảm đi độ sáng phòng giặt ủi 1 đi 11 phần trăm,smart.home.decrease.percentage,0,smart.home.decrease.percentage,0,smart.home.decrease.percentage
có thể hạ thấp đèn rọi thứ 2 đỡ đi 3 phần trăm không,smart.home.decrease.percentage,0,smart.home.decrease.percentage,0,smart.home.decrease.percentage
device đèn nhiều màu room phòng chung 2 phần trăm 3 phần trăm,smart.home.decrease.percentage,0,smart.home.decrease.percentage,0,smart.home.decrease.percentage
giảm độ sáng công ty đi 16 phần trăm,smart.home.decrease.percentage,0,smart.home.decrease.percentage,0,smart.home.decrease.percentage
cho mình giảm bóng học thứ 1 ở ga ra 5 mức 10 phần trăm,smart.home.decrease.percentage,0,smart.home.decrease.percentage,0,smart.home.decrease.percentage
giảm độ sáng đèn tròn 4 ấy trợ lý ảo nó sáng quá,smart.home.decrease.percentage,0,smart.home.decrease.percentage,True,smart.home.decrease.level
giảm bớt đèn lồng thứ 4 vườn 5 xuống 11 phần trăm nữa,smart.home.decrease.percentage,0,smart.home.decrease.percentage,0,smart.home.decrease.percentage
đèn vách 1 phòng bếp 4 hạ thấp 15 phần trăm,smart.home.decrease.percentage,0,smart.home.decrease.percentage,0,smart.home.decrease.percentage
giảm cho mình ti vi thứ 3 ở đại sảnh xuống 20 phần trăm nhé,smart.home.decrease.percentage,0,smart.home.decrease.percentage,0,smart.home.decrease.percentage
giúp mình giảm đèn vườn xuống 27 phần trăm với ạ,smart.home.decrease.percentage,0,smart.home.decrease.percentage,0,smart.home.decrease.percentage
giảm loa còi thứ 4 về 15 phần trăm ở phòng lễ tân,smart.home.decrease.percentage,0,smart.home.decrease.percentage,0,smart.home.decrease.percentage
giảm giúp mình bóng ốp trần 1 nhé,smart.home.decrease.percentage,True,smart.home.decrease.level,True,smart.home.decrease.level
giảm giúp mình cảnh tại nhà tắm 4 xuống 13 phần trăm nhé,smart.home.decrease.percentage,0,smart.home.decrease.percentage,0,smart.home.decrease.percentage
cho cái bóng hắt tường thứ 3 xuống 7 phần trăm hộ tôi với,smart.home.decrease.percentage,0,smart.home.decrease.percentage,0,smart.home.decrease.percentage
tôi đang cần giảm mức độ đèn bóng trần phòng thu,smart.home.decrease.percentage,0,smart.home.decrease.percentage,True,smart.home.decrease.level
giảm giúp tôi độ sáng bóng trang trí thứ 3 ngoài phòng thay đồ xuống với,smart.home.decrease.percentage,0,smart.home.decrease.percentage,True,smart.home.decrease.level
giảm giúp mình điện thứ 3 nhé,smart.home.decrease.percentage,True,smart.home.decrease.level,True,smart.home.decrease.level
giúp tôi hạ thấp bóng đứng phòng lễ tân xuống 22 phần trăm,smart.home.decrease.percentage,0,smart.home.decrease.percentage,0,smart.home.decrease.percentage
giảm hộ mình đèn đứng 4 xuống 3 phần trăm nhé,smart.home.decrease.percentage,0,smart.home.decrease.percentage,0,smart.home.decrease.percentage
đèn đứng thứ 4 cổng chính hạ thấp 23 phần trăm,smart.home.decrease.percentage,0,smart.home.decrease.percentage,0,smart.home.decrease.percentage
thôi vào việc nhé màn cửa nhìn ngứa mắt quá giảm cho anh xuống 8 phần trăm nhé à cái rèm đơn nhé,smart.home.decrease.percentage,0,smart.home.decrease.percentage,0,smart.home.decrease.percentage
bóng trụ cổng 3 phòng trẻ em nên được hạ xuống xuống mức 9 phần trăm,smart.home.decrease.percentage,0,smart.home.decrease.percentage,0,smart.home.decrease.percentage
led ở nhà vệ sinh về 29 phần trăm,smart.home.decrease.percentage,True,smart.home.set.percentage,0,smart.home.decrease.percentage
hello giảm giúp mình bóng thứ 3 ở phòng sếp xuống 14 phần trăm nhé,smart.home.decrease.percentage,0,smart.home.decrease.percentage,0,smart.home.decrease.percentage
giảm độ sáng bóng tiết kiệm điện thứ 4 ấy trợ lý ảo nó sáng quá,smart.home.decrease.percentage,0,smart.home.decrease.percentage,True,smart.home.decrease.level
thôi vào việc nhé màn cửa nhìn ngứa mắt quá giảm cho anh xuống 5 phần trăm nhé à cái mành đôi 2 nhé,smart.home.decrease.percentage,0,smart.home.decrease.percentage,0,smart.home.decrease.percentage
đèn cây 1 ở phòng bố mẹ về 16 phần trăm,smart.home.decrease.percentage,True,smart.home.set.percentage,0,smart.home.decrease.percentage
có thể giảm bớt công tắc 1 đỡ đi 24 phần trăm không,smart.home.decrease.percentage,0,smart.home.decrease.percentage,0,smart.home.decrease.percentage
có thể hạ thấp tvs 1 đỡ đi 14 phần trăm không,smart.home.decrease.percentage,0,smart.home.decrease.percentage,0,smart.home.decrease.percentage
giảm bóng treo tường 1 ở phòng ông bà 2 xuống 17 phần trăm cho mình với,smart.home.decrease.percentage,0,smart.home.decrease.percentage,0,smart.home.decrease.percentage
hạ xuống độ sáng phòng vệ sinh 2 đi 4 phần trăm,smart.home.decrease.percentage,0,smart.home.decrease.percentage,0,smart.home.decrease.percentage
cho mình giảm loa còi thứ 4 với,smart.home.decrease.percentage,0,smart.home.decrease.percentage,True,smart.home.decrease.level
có thể hạ thấp van nước thứ 2 đỡ đi 22 phần trăm không,smart.home.decrease.percentage,0,smart.home.decrease.percentage,0,smart.home.decrease.percentage
cho cái đèn sưởi thứ 4 xuống 17 phần trăm hộ tôi với,smart.home.decrease.percentage,0,smart.home.decrease.percentage,0,smart.home.decrease.percentage
hạ độ sáng nóng lạnh 1 xuống 50 phần trăm,smart.home.decrease.percentage,0,smart.home.decrease.percentage,0,smart.home.decrease.percentage
giảm bớt độ sáng tủ giữ đồ 2 đi 14 phần trăm,smart.home.decrease.percentage,0,smart.home.decrease.percentage,0,smart.home.decrease.percentage
cho cái kịch bản 2 xuống 4 phần trăm hộ tôi với,smart.home.decrease.percentage,0,smart.home.decrease.percentage,0,smart.home.decrease.percentage
giảm hộ mình bóng kiểng thứ 2 xuống 7 phần trăm nhé,smart.home.decrease.percentage,0,smart.home.decrease.percentage,0,smart.home.decrease.percentage
có thể hạ hắt trần thứ 3 đỡ đi 8 phần trăm không,smart.home.decrease.percentage,0,smart.home.decrease.percentage,0,smart.home.decrease.percentage
giảm giúp mình loa đài thứ 3 nhé,smart.home.decrease.percentage,True,smart.home.decrease.level,True,smart.home.decrease.level
hạ xuống loa thứ 4 ga ra 3 xuống 11 phần trăm nữa,smart.home.decrease.percentage,0,smart.home.decrease.percentage,0,smart.home.decrease.percentage
mình cần sự trợ giúp trong việc giảm đèn học,smart.home.decrease.percentage,True,smart.home.decrease.level,True,smart.home.decrease.level
hello giảm giúp mình loa còi 3 ở phòng em nhỏ 3 xuống 28 phần trăm nhé,smart.home.decrease.percentage,0,smart.home.decrease.percentage,0,smart.home.decrease.percentage
giảm bóng để bàn thứ 2 thư viện 29 phần trăm,smart.home.decrease.percentage,0,smart.home.decrease.percentage,0,smart.home.decrease.percentage
mành cuốn thứ 2 sảnh hạ thấp 47 phần trăm,smart.home.decrease.percentage,0,smart.home.decrease.percentage,0,smart.home.decrease.percentage
tôi đang cần giảm mức độ đèn bóng trần phòng đọc,smart.home.decrease.percentage,0,smart.home.decrease.percentage,True,smart.home.decrease.level
giảm đi rèm cửa xuống mức độ sáng 1 phần trăm,smart.home.decrease.percentage,0,smart.home.decrease.percentage,0,smart.home.decrease.percentage
giảm hộ anh bóng học thứ 1 ở phòng dành cho nam 4 3 phần trăm,smart.home.decrease.percentage,0,smart.home.decrease.percentage,0,smart.home.decrease.percentage
giảm thiết bị bóng tiết kiệm điện thứ 3 cho tôi với,smart.home.decrease.percentage,0,smart.home.decrease.percentage,True,smart.home.decrease.level
giảm cho mình đèn cây 4 ở phòng em bé xuống 20 phần trăm nhé,smart.home.decrease.percentage,0,smart.home.decrease.percentage,0,smart.home.decrease.percentage
ok bạn ơi giảm cho mình đèn treo tường 4 xuống 23 phần trăm nhé,smart.home.decrease.percentage,0,smart.home.decrease.percentage,0,smart.home.decrease.percentage
cho mình giảm bóng đứng 3 với,smart.home.decrease.percentage,0,smart.home.decrease.percentage,True,smart.home.decrease.level
giảm độ sáng phòng là 1 đi 30 phần trăm,smart.home.decrease.percentage,0,smart.home.decrease.percentage,0,smart.home.decrease.percentage
giảm rèm đôi ở phòng là xuống 26 phần trăm cho mình với,smart.home.decrease.percentage,0,smart.home.decrease.percentage,0,smart.home.decrease.percentage
quạt 3 sân trước nên được hạ xuống xuống mức 30 phần trăm,smart.home.decrease.percentage,0,smart.home.decrease.percentage,0,smart.home.decrease.percentage
giảm bớt hắt tường thứ 3 phòng nghiên cứu 3 xuống 2 phần trăm hộ tôi với,smart.home.decrease.percentage,0,smart.home.decrease.percentage,0,smart.home.decrease.percentage
em làm ơn giúp tôi giảm rèm cửa thứ 2 xuống 1 phần trăm tôi hơi bị chói mắt,smart.home.decrease.percentage,0,smart.home.decrease.percentage,0,smart.home.decrease.percentage
hãy giảm loa trong hè sau 4 xuống 29 phần trăm,smart.home.decrease.percentage,0,smart.home.decrease.percentage,0,smart.home.decrease.percentage
đèn ngủ phòng sinh hoạt chung 2 nên được giảm bớt xuống mức 34 phần trăm,smart.home.decrease.percentage,0,smart.home.decrease.percentage,0,smart.home.decrease.percentage
giúp tôi giảm nút ấn thứ 2 đầu hè 3 xuống 49 phần trăm,smart.home.decrease.percentage,0,smart.home.decrease.percentage,0,smart.home.decrease.percentage
ok bạn ơi giảm cho mình kịch bản xuống 9 phần trăm nhé,smart.home.decrease.percentage,0,smart.home.decrease.percentage,0,smart.home.decrease.percentage
giảm bớt bóng vách 1 nhà để xe 3 xuống 38 phần trăm hộ tôi với,smart.home.decrease.percentage,0,smart.home.decrease.percentage,0,smart.home.decrease.percentage
giúp tôi giảm cửa cuốn thứ 1 phòng giám đốc xuống 40 phần trăm,smart.home.decrease.percentage,0,smart.home.decrease.percentage,0,smart.home.decrease.percentage
giảm hộ anh bóng hoa 2 ở đại sảnh 15 phần trăm,smart.home.decrease.percentage,0,smart.home.decrease.percentage,0,smart.home.decrease.percentage
giảm bóng hoa phòng ngủ các con xuống 19 phần trăm nữa,smart.home.decrease.percentage,0,smart.home.decrease.percentage,0,smart.home.decrease.percentage
giúp mình giảm công tắc 2 xuống 10 phần trăm với ạ,smart.home.decrease.percentage,0,smart.home.decrease.percentage,0,smart.home.decrease.percentage
giảm bớt bóng hắt tường 4 xuống mức độ sáng 45 phần trăm,smart.home.decrease.percentage,0,smart.home.decrease.percentage,0,smart.home.decrease.percentage
hạ thấp đèn thả 4 phòng giặt ủi xuống 16 phần trăm hộ tôi với,smart.home.decrease.percentage,0,smart.home.decrease.percentage,0,smart.home.decrease.percentage
giúp mình giảm đèn tường thứ 4 xuống 8 phần trăm với ạ,smart.home.decrease.percentage,0,smart.home.decrease.percentage,0,smart.home.decrease.percentage
hạ đèn học thứ 4 xuống mức độ sáng 10 phần trăm,smart.home.decrease.percentage,0,smart.home.decrease.percentage,0,smart.home.decrease.percentage
mình cần sự trợ giúp trong việc giảm đèn chùm thứ 1,smart.home.decrease.percentage,0,smart.home.decrease.percentage,True,smart.home.decrease.level
đèn đứng phòng hội nghị giảm bớt 25 phần trăm,smart.home.decrease.percentage,0,smart.home.decrease.percentage,0,smart.home.decrease.percentage
thôi vào việc nhé màn cửa nhìn ngứa mắt quá giảm cho anh xuống 27 phần trăm nhé à cái bóng sợi đốt nhé,smart.home.decrease.percentage,0,smart.home.decrease.percentage,0,smart.home.decrease.percentage
tôi đang cần giảm mức độ đèn bóng trần phòng họp gia đình 5,smart.home.decrease.percentage,0,smart.home.decrease.percentage,True,smart.home.decrease.level
giảm độ sáng mành thứ 3 ấy trợ lý ảo nó sáng quá,smart.home.decrease.percentage,0,smart.home.decrease.percentage,True,smart.home.decrease.level
giảm kịch bản về 23 phần trăm ở trong phòng chánh,smart.home.decrease.percentage,0,smart.home.decrease.percentage,0,smart.home.decrease.percentage
tôi cần hạ thấp đèn thứ 1 tầng 7 đi 3 phần trăm,smart.home.decrease.percentage,0,smart.home.decrease.percentage,0,smart.home.decrease.percentage
em làm ơn giúp tôi giảm đèn hoa thứ 4 xuống 18 phần trăm tôi hơi bị chói mắt,smart.home.decrease.percentage,0,smart.home.decrease.percentage,0,smart.home.decrease.percentage
em làm ơn giúp tôi giảm bình nóng lạnh 1 xuống 16 phần trăm tôi hơi bị chói mắt,smart.home.decrease.percentage,0,smart.home.decrease.percentage,0,smart.home.decrease.percentage
mình cần sự trợ giúp trong việc giảm bóng sợi đốt thứ 3,smart.home.decrease.percentage,0,smart.home.decrease.percentage,True,smart.home.decrease.level
bạn giúp mình giảm đèn làm việc đi 2 phần trăm được không mình cảm ơn,smart.home.decrease.percentage,0,smart.home.decrease.percentage,0,smart.home.decrease.percentage
trong hành lang 2 hãy giảm bóng trụ cổng xuống 27 phần trăm,smart.home.decrease.percentage,0,smart.home.decrease.percentage,0,smart.home.decrease.percentage
giúp mình giảm đèn tiết kiệm điện 2 xuống 6 phần trăm với ạ,smart.home.decrease.percentage,0,smart.home.decrease.percentage,0,smart.home.decrease.percentage
giảm cho mình bóng vách 2 ở phòng tắm xuống 24 phần trăm nhé,smart.home.decrease.percentage,0,smart.home.decrease.percentage,0,smart.home.decrease.percentage
em làm ơn giúp tôi giảm led 2 xuống 21 phần trăm tôi hơi bị chói mắt,smart.home.decrease.percentage,0,smart.home.decrease.percentage,0,smart.home.decrease.percentage
giảm quạt hút mùi thứ 1 ở phòng lễ tân xuống 28 phần trăm cho mình với,smart.home.decrease.percentage,0,smart.home.decrease.percentage,0,smart.home.decrease.percentage
hạ xuống độ sáng đèn tranh 3 xuống 18 phần trăm,smart.home.decrease.percentage,0,smart.home.decrease.percentage,0,smart.home.decrease.percentage
