text,old_intent,is_diff,new_intent,is_diff_relabel,relabel_intent
kiểm tra giúp mình cái quạt trần 2 ở phòng họp gia đình 5 nhé,smart.home.check.status,0,smart.home.check.status,0,smart.home.check.status
mình muốn kiểm tra trạng thái của điều hoà 2,smart.home.check.status,0,smart.home.check.status,0,smart.home.check.status
kiểu tra giúp mình rèm đôi 2 với,smart.home.check.status,True,smart.home.increase.level,0,smart.home.check.status
kiểm tra trạng thái rèm ngang 2,smart.home.check.status,0,smart.home.check.status,0,smart.home.check.status
kiểm tra trạng thái ốp tường giúp mình với ạ,smart.home.check.status,0,smart.home.check.status,0,smart.home.check.status
xin chào hãy kiểm tra hộ mình ốp trần thứ 3 với,smart.home.check.status,0,smart.home.check.status,0,smart.home.check.status
tôi muốn bạn kiểm tra cho tôi trạng thái của màn cửa đơn,smart.home.check.status,0,smart.home.check.status,0,smart.home.check.status
bạn ơi kiểm tra đèn sắc màu ở phòng là 4 dùm mình,smart.home.check.status,0,smart.home.check.status,0,smart.home.check.status
chào bạn giúp mình kiểm tra bóng thả 1 ở sân sau nhé,smart.home.check.status,0,smart.home.check.status,0,smart.home.check.status
bạn ơi kiểm tra bóng compact thứ 1 ở nhà bếp 3 dùm mình,smart.home.check.status,0,smart.home.check.status,0,smart.home.check.status
tôi muốn bạn kiểm tra cho tôi trạng thái của âm thanh đa vùng thứ 4,smart.home.check.status,0,smart.home.check.status,0,smart.home.check.status
bạn cho mình biết thông tin đèn lồng thứ 4 được không ạ,smart.home.check.status,True,smart.home.set.percentage,0,smart.home.check.status
này giúp mình kiểm tra ốp trần 4 nhé,smart.home.check.status,0,smart.home.check.status,0,smart.home.check.status
kiểm tra đèn âm trần 1 phòng ủi,smart.home.check.status,0,smart.home.check.status,0,smart.home.check.status
bạn kiểm tra cho mình quạt treo tường thứ 4 với,smart.home.check.status,0,smart.home.check.status,0,smart.home.check.status
đèn nhiều màu 3 chưa tắt,smart.home.check.status,True,smart.home.set.color,0,smart.home.check.status
quét đèn thờ 4 bếp 5,smart.home.check.status,True,smart.home.increase.level,0,smart.home.check.status
kiểm tra giúp anh đồ ở phòng nam 5 nhé,smart.home.check.status,0,smart.home.check.status,0,smart.home.check.status
này giúp mình kiểm tra vô tuyến 3 nhé,smart.home.check.status,0,smart.home.check.status,0,smart.home.check.status
ti vi thứ 3 đang đóng ah,smart.home.check.status,True,smart.home.set.percentage,0,smart.home.check.status
xin chào hãy kiểm tra hộ mình nóng lạnh 2 với,smart.home.check.status,0,smart.home.check.status,0,smart.home.check.status
thiết bị đèn led thứ 1 room phòng chánh 3,smart.home.check.status,True,smart.home.decrease.level,0,smart.home.check.status
mình muốn kiểm tra trạng thái của đèn cổng,smart.home.check.status,0,smart.home.check.status,0,smart.home.check.status
kiểm tra giúp mình cái bóng học ở phòng ngủ con 1 nhé,smart.home.check.status,0,smart.home.check.status,0,smart.home.check.status
kiểm tra cho mình cảnh nhé chắc bị trục trặc gì rồi,smart.home.check.status,0,smart.home.check.status,0,smart.home.check.status
bạn cho mình biết thông tin đèn vách 1 được không ạ,smart.home.check.status,True,smart.home.set.percentage,0,smart.home.check.status
tôi cần bạn giúp hãy thử kiểm tra giúp tôi cái nút nhấn 4 ở phòng ăn sáng xem nó đã bật chưa,smart.home.check.status,0,smart.home.check.status,0,smart.home.check.status
giúp mình kiểm tra đèn treo tường thứ 3 ở phòng em nhỏ xem nó như thế nào nhé,smart.home.check.status,0,smart.home.check.status,0,smart.home.check.status
em ơi check giúp anh xem van nước có bật không nhá,smart.home.check.status,0,smart.home.check.status,0,smart.home.check.status
cho mình xem trạng thái của mành đôi 1 ở phòng thờ,smart.home.check.status,0,smart.home.check.status,0,smart.home.check.status
kiểm tra trạng thái bóng cho mình với,smart.home.check.status,0,smart.home.check.status,0,smart.home.check.status
kiểm tra trạng thái quạt thông gió cho mình với,smart.home.check.status,0,smart.home.check.status,0,smart.home.check.status
kiểm tra cho mình thiết bị ở nhà tắm 5,smart.home.check.status,0,smart.home.check.status,0,smart.home.check.status
kiểm tra trạng thái của thiết bị device là điều hoà 1 room là phòng tắm xông hơi 5 nhé bạn eei,smart.home.check.status,0,smart.home.check.status,0,smart.home.check.status
mành cuốn 1 phòng đợi 5 được mở,smart.home.check.status,True,smart.home.set.percentage,0,smart.home.check.status
bóng huỳnh quang 2 chưa đóng,smart.home.check.status,True,smart.home.set.percentage,0,smart.home.check.status
kiểm tra trạng thái của bóng thờ 1,smart.home.check.status,0,smart.home.check.status,0,smart.home.check.status
kiểm tra bóng chùm thứ 4 ở sân vườn 1,smart.home.check.status,0,smart.home.check.status,0,smart.home.check.status
hắt trần thứ 2 phòng ăn trưa 3 đang mở hay đóng,smart.home.check.status,True,smart.home.set.percentage,0,smart.home.check.status
bạn có thế kiểm tra màn cuốn 3 ở phòng giặt ủi 4 được không,smart.home.check.status,0,smart.home.check.status,0,smart.home.check.status
kiểm tra trạng thái đèn tuýp giúp mình với ạ,smart.home.check.status,0,smart.home.check.status,0,smart.home.check.status
xin chào hãy kiểm tra hộ mình bóng ngủ với,smart.home.check.status,0,smart.home.check.status,0,smart.home.check.status
đèn bàn thứ 2 phòng thực hành 4 đang ở mở hoặc đóng nào,smart.home.check.status,True,smart.home.set.percentage,0,smart.home.check.status
kiểm tra giúp anh đồ ở thư viện nhé,smart.home.check.status,0,smart.home.check.status,0,smart.home.check.status
kiểm tra giúp tôi đèn vườn 1 với,smart.home.check.status,0,smart.home.check.status,0,smart.home.check.status
hey kiểm tra giúp tôi trạng thái của đèn màu sắc thứ 3 với,smart.home.check.status,0,smart.home.check.status,0,smart.home.check.status
kiểm tra giúp anh đồ ở phòng bố mẹ nhé,smart.home.check.status,0,smart.home.check.status,0,smart.home.check.status
màn cửa đơn thứ 4 quầy lễ tân 5 đang ở đang tắt nào,smart.home.check.status,True,smart.home.device.onoff,0,smart.home.check.status
tôi muốn bạn kiểm tra cho tôi trạng thái của điều hòa thứ 2,smart.home.check.status,0,smart.home.check.status,0,smart.home.check.status
mình muốn kiểm tra đèn sắc màu 1 ở phòng,smart.home.check.status,0,smart.home.check.status,0,smart.home.check.status
kiểm tra hồ mình bòng hắt trần ở phòng chính 5 với,smart.home.check.status,0,smart.home.check.status,0,smart.home.check.status
bạn cho mình biết thông tin đèn bếp được không ạ,smart.home.check.status,True,smart.home.set.percentage,0,smart.home.check.status
bạn ơi kiểm tra bóng thờ 3 ở phòng nghỉ ngơi 3 dùm mình,smart.home.check.status,0,smart.home.check.status,0,smart.home.check.status
kiểm tra điều hoà 2 phòng ngủ con trai 1,smart.home.check.status,0,smart.home.check.status,0,smart.home.check.status
kiểm tra trạng thái vô tuyến 3 giúp mình với ạ,smart.home.check.status,0,smart.home.check.status,0,smart.home.check.status
cho mình xem trạng thái của huỳnh quang 1 ở phòng trẻ em 3,smart.home.check.status,0,smart.home.check.status,0,smart.home.check.status
kiểm tra hộ mình đèn nhiều màu 2 ở sân vườn,smart.home.check.status,0,smart.home.check.status,0,smart.home.check.status
bạn kiểm tra cho mình bóng hắt 3 với,smart.home.check.status,0,smart.home.check.status,0,smart.home.check.status
em ơi check giúp anh xem cảnh có bật không nhá,smart.home.check.status,0,smart.home.check.status,0,smart.home.check.status
quạt trần 2 đã bật ah,smart.home.check.status,True,smart.home.device.onoff,0,smart.home.check.status
kiểm tra trạng thái bóng hắt tường 1,smart.home.check.status,0,smart.home.check.status,0,smart.home.check.status
kiểm tra trạng thái của van nước trong phòng tắm 5,smart.home.check.status,0,smart.home.check.status,0,smart.home.check.status
kiểm tra đèn tường 3 ở sảnh,smart.home.check.status,0,smart.home.check.status,0,smart.home.check.status
kiểm tra hộ mình bóng sợi đốt ở phòng sếp 2,smart.home.check.status,0,smart.home.check.status,0,smart.home.check.status
xem luôn hộ đèn cây 4 ở ga ra 3 nhá,smart.home.check.status,True,smart.home.set.level,0,smart.home.check.status
mình muốn kiểm tra bóng để bàn thứ 3 ở tiền sảnh 4,smart.home.check.status,0,smart.home.check.status,0,smart.home.check.status
kiểu tra giúp mình bình nóng lạnh với,smart.home.check.status,True,smart.home.increase.level,0,smart.home.check.status
kiểm tra trạng thái của ốp tường 2,smart.home.check.status,0,smart.home.check.status,0,smart.home.check.status
mình muốn kiểm tra rèm ngang ở phòng họp,smart.home.check.status,0,smart.home.check.status,0,smart.home.check.status
kiểm tra trạng thái ốp tường cho mình với,smart.home.check.status,0,smart.home.check.status,0,smart.home.check.status
kiểm tra giúp mình trạng thái của đèn cổng nhé,smart.home.check.status,0,smart.home.check.status,0,smart.home.check.status
bạn ơi kiểm tra cho mình loa còi thứ 2 với,smart.home.check.status,0,smart.home.check.status,0,smart.home.check.status
kiểm tra hộ mình nóng lạnh 2 ở nhà vệ sinh,smart.home.check.status,0,smart.home.check.status,0,smart.home.check.status
bóng tròn phòng làm việc 1 nhanh bot ơi giúp mình với,smart.home.check.status,0,smart.home.check.status,0,smart.home.check.status
đúng không trạng thái quạt thông gió thứ 3 trên tầng 5,smart.home.check.status,0,smart.home.check.status,0,smart.home.check.status
đèn rủ lễ tân 5 được tắt,smart.home.check.status,True,smart.home.device.onoff,0,smart.home.check.status
kiểm tra kiểng 3 giúp tôi,smart.home.check.status,0,smart.home.check.status,0,smart.home.check.status
tôi muốn bạn kiểm tra cho tôi trạng thái của công tắc,smart.home.check.status,0,smart.home.check.status,0,smart.home.check.status
kiếm tra giúp mình trạng thái của thiết bị đèn quảng cáo ở phòng sếp nhée,smart.home.check.status,0,smart.home.check.status,0,smart.home.check.status
kiểm tra trạng thái của tivi ở sân vườn 3 nhé,smart.home.check.status,0,smart.home.check.status,0,smart.home.check.status
kiểm tra trạng thái cột đèn 4,smart.home.check.status,0,smart.home.check.status,0,smart.home.check.status
mình muốn kiểm tra bóng ngủ ở phòng tắm,smart.home.check.status,0,smart.home.check.status,0,smart.home.check.status
này giúp mình kiểm tra bóng trụ cổng nhé,smart.home.check.status,0,smart.home.check.status,0,smart.home.check.status
bạn kiểm tra giúp mình thiết bị điều hoà 1 ở phòng chính 1 nhé,smart.home.check.status,0,smart.home.check.status,0,smart.home.check.status
kiểm tra hồ mình bóng âm trần 2 ở phòng giặt ủi 4 với,smart.home.check.status,0,smart.home.check.status,0,smart.home.check.status
hi bạn mình muốn kiểm tra trạng thái thiết bị đèn downlight,smart.home.check.status,0,smart.home.check.status,0,smart.home.check.status
kiểm tra trạng thái đèn 2 phòng sinh hoạt chung 1,smart.home.check.status,0,smart.home.check.status,0,smart.home.check.status
kiểm tra kiểng thứ 3 ở phòng nhé,smart.home.check.status,0,smart.home.check.status,0,smart.home.check.status
kiểm tra hồ mình đèn âm trần thứ 4 ở phòng 2 với,smart.home.check.status,0,smart.home.check.status,0,smart.home.check.status
kiểm tra trạng thái của rèm ngang thứ 4 ở phòng sinh hoạt chung nhé,smart.home.check.status,0,smart.home.check.status,0,smart.home.check.status
kiểm tra giúp mình cái rèm đơn ở phòng con 4 nhé,smart.home.check.status,0,smart.home.check.status,0,smart.home.check.status
kiểm tra bóng kiểng thứ 3 hiên sau,smart.home.check.status,0,smart.home.check.status,0,smart.home.check.status
kiểm tra cho mình nút ấn nhé chắc bị trục trặc gì rồi,smart.home.check.status,0,smart.home.check.status,0,smart.home.check.status
thông báo đèn vườn 2,smart.home.check.status,True,smart.home.increase.level,0,smart.home.check.status
đúng không đèn led thứ 3 phòng ngủ 4,smart.home.check.status,True,smart.home.device.onoff,0,smart.home.check.status
kiểm tra trạng thái nút ấn 3 giúp mình với ạ,smart.home.check.status,0,smart.home.check.status,0,smart.home.check.status
kiểm tra cho mình bóng compact thứ 4 nhé chắc bị trục trặc gì rồi,smart.home.check.status,0,smart.home.check.status,0,smart.home.check.status
xin chào t thấy rèm đôi 3 đang có vấn đề bạn kiểm tra giúp với trong phòng nam 1 nhé,smart.home.check.status,0,smart.home.check.status,0,smart.home.check.status
bóng sợi đốt thứ 2 phòng giặt nhanh bot ơi giúp mình với,smart.home.check.status,0,smart.home.check.status,0,smart.home.check.status
quét trạng thái đèn trần thứ 1 garage 1,smart.home.check.status,0,smart.home.check.status,0,smart.home.check.status
kiểm tra giúp mình trạng thái của hắt trần nhé,smart.home.check.status,0,smart.home.check.status,0,smart.home.check.status
trợ lý ơi giúp mình kiểm tra cái cảnh tại vườn 1 nhé báo lại trạng thái giúp mình,smart.home.check.status,0,smart.home.check.status,0,smart.home.check.status
thiết bị đèn rủ room phòng ăn tối 3,smart.home.check.status,0,smart.home.check.status,0,smart.home.check.status
đèn thả 4 phòng ngủ ông bà nhanh bot ơi giúp mình với,smart.home.check.status,0,smart.home.check.status,0,smart.home.check.status
kiểm tra giúp mình cái bóng làm việc 3 ở phòng thay đồ nhé,smart.home.check.status,0,smart.home.check.status,0,smart.home.check.status
đúng không quạt trần thứ 4,smart.home.check.status,True,smart.home.set.percentage,0,smart.home.check.status
trợ lý kiểm tra giúp tôi đèn bếp ở phòng thu 5 nhé,smart.home.check.status,0,smart.home.check.status,0,smart.home.check.status
bạn ơi kiểm tra cho mình đèn sưởi thứ 1 với,smart.home.check.status,0,smart.home.check.status,0,smart.home.check.status
cho mình xem trạng thái của bóng hoa ở phòng dành cho nữ,smart.home.check.status,0,smart.home.check.status,0,smart.home.check.status
quét trạng thái bóng kiểng 1 phòng tiếp đón,smart.home.check.status,0,smart.home.check.status,0,smart.home.check.status
nút ấn thứ 2 phòng hội nghị nhanh bot ơi giúp mình với,smart.home.check.status,0,smart.home.check.status,0,smart.home.check.status
tôi muốn bạn kiểm tra cho tôi trạng thái của rèm cửa thứ 4,smart.home.check.status,0,smart.home.check.status,0,smart.home.check.status
kiểm tra trạng thái của thiết bị device là đèn màu room là phòng thí nghiệm nhé bạn eei,smart.home.check.status,0,smart.home.check.status,0,smart.home.check.status
hi bạn mình muốn kiểm tra trạng thái thiết bị đèn sắc màu 3,smart.home.check.status,0,smart.home.check.status,0,smart.home.check.status
xem luôn hộ bóng sợi đốt 2 ở phòng ngủ các con nhá,smart.home.check.status,True,smart.home.set.level,0,smart.home.check.status
bạn ơi kiểm tra cho mình rèm đôi thứ 2 với,smart.home.check.status,0,smart.home.check.status,0,smart.home.check.status
kiểm tra giúp tôi bóng hoa với,smart.home.check.status,0,smart.home.check.status,0,smart.home.check.status
kiểm tra trạng thái đèn học 2 trên tầng thượng 10,smart.home.check.status,0,smart.home.check.status,0,smart.home.check.status
em ơi check giúp anh xem đèn sợi đốt có bật không nhá,smart.home.check.status,True,smart.home.device.onoff,0,smart.home.check.status
kiểm tra trạng thái của thiết bị device là bóng tiết kiệm điện room là quầy lễ tân nhé bạn eei,smart.home.check.status,0,smart.home.check.status,0,smart.home.check.status
giúp mình kiểm tra bóng thả 1 ở ga ra xem nó như thế nào nhé,smart.home.check.status,0,smart.home.check.status,0,smart.home.check.status
kiểm tra trạng thái của ốp trần 1 trong phòng thờ,smart.home.check.status,0,smart.home.check.status,0,smart.home.check.status
bạn ơi kiểm tra đèn thả 2 ở cầu thang dùm mình,smart.home.check.status,0,smart.home.check.status,0,smart.home.check.status
bạn kiểm tra cho mình đèn học với,smart.home.check.status,0,smart.home.check.status,0,smart.home.check.status
giúp mình kiểm tra đèn chùm 3 ở bếp 4 xem nó như thế nào nhé,smart.home.check.status,0,smart.home.check.status,0,smart.home.check.status
mình muốn kiểm tra trạng thái của ốp tường 4,smart.home.check.status,0,smart.home.check.status,0,smart.home.check.status
mình muốn kiểm tra bóng rọi 1 ở phòng tắm 2,smart.home.check.status,0,smart.home.check.status,0,smart.home.check.status
bạn kiểm tra giúp mình thiết bị đèn sưởi thứ 4 ở hội trường 3 nhé,smart.home.check.status,0,smart.home.check.status,0,smart.home.check.status
bạn có thế kiểm tra nóng lạnh 3 ở phòng sếp 1 được không,smart.home.check.status,0,smart.home.check.status,0,smart.home.check.status
xem luôn hộ điều hoà 4 ở đầu hè nhá,smart.home.check.status,True,smart.home.set.level,0,smart.home.check.status
kiểm tra giúp tôi tvs thứ 3 với,smart.home.check.status,0,smart.home.check.status,0,smart.home.check.status
kiếm tra giúp mình trạng thái của thiết bị đèn led 4 ở tiền sảnh 2 nhée,smart.home.check.status,0,smart.home.check.status,0,smart.home.check.status
trợ lý kiểm tra giúp tôi đèn trang trí thứ 1 ở đầu hè 1 nhé,smart.home.check.status,0,smart.home.check.status,0,smart.home.check.status
hi bạn mình muốn kiểm tra trạng thái thiết bị đèn vách 1,smart.home.check.status,0,smart.home.check.status,0,smart.home.check.status
kiểm tra hồ mình kiểng 2 ở phòng chánh 5 với,smart.home.check.status,0,smart.home.check.status,0,smart.home.check.status
xin chào t thấy bóng vách 2 đang có vấn đề bạn kiểm tra giúp với trong hè nhé,smart.home.check.status,0,smart.home.check.status,0,smart.home.check.status
thông báo bóng hắt tường thứ 4,smart.home.check.status,True,smart.home.increase.percentage,0,smart.home.check.status
kiểm tra đèn quảng cáo giúp tôi,smart.home.check.status,0,smart.home.check.status,0,smart.home.check.status
xin chào hãy kiểm tra hộ mình nút ấn với,smart.home.check.status,0,smart.home.check.status,0,smart.home.check.status
xin chào t thấy đèn màu đang có vấn đề bạn kiểm tra giúp với trong nhà xe 5 nhé,smart.home.check.status,0,smart.home.check.status,0,smart.home.check.status
kiểm tra cho mình bóng làm việc 1 nhé chắc bị trục trặc gì rồi,smart.home.check.status,0,smart.home.check.status,0,smart.home.check.status
màn cửa đôi 1 tắt hoặc bật ah,smart.home.check.status,True,smart.home.device.onoff,0,smart.home.check.status
bạn kiểm tra giúp mình thiết bị đèn vách ở phòng chính 4 nhé,smart.home.check.status,0,smart.home.check.status,0,smart.home.check.status
kiểm tra bóng học phòng ủi,smart.home.check.status,0,smart.home.check.status,0,smart.home.check.status
kiểm tra giúp anh đồ ở phòng nữ nhé,smart.home.check.status,0,smart.home.check.status,0,smart.home.check.status
kiểm tra trạng thái của thiết bị device là đèn sân thứ 2 room là hành lang 5 nhé bạn eei,smart.home.check.status,0,smart.home.check.status,0,smart.home.check.status
kiếm tra giúp mình trạng thái của thiết bị cột đèn 1 ở sân trước nhée,smart.home.check.status,0,smart.home.check.status,0,smart.home.check.status
kiểm tra trạng thái đèn tranh,smart.home.check.status,0,smart.home.check.status,0,smart.home.check.status
hey kiểm tra giúp tôi trạng thái của bóng để bàn thứ 3 với,smart.home.check.status,0,smart.home.check.status,0,smart.home.check.status
bạn thay đổi màu sắc giúp mình màn cửa thứ 2 với,smart.home.set.color,True,smart.home.increase.level,0,smart.home.set.color
cài đặt thiết bị đèn thả 4 sang xanh lam ở hè sau 5 and tầng thượng 10,smart.home.set.color,True,smart.home.set.percentage,0,smart.home.set.color
xin chào mình cần chạy màu đèn treo tường 3 sang màu đỏ,smart.home.set.color,0,smart.home.set.color,0,smart.home.set.color
trợ lý fuck boi khởi chạy cho anh bóng để bàn sang màu xanh da trời trên sảnh 3 tầng hầm 4,smart.home.set.color,0,smart.home.set.color,0,smart.home.set.color
tôi cần đổi màu sắc màu đèn quảng cáo sang màu tía,smart.home.set.color,0,smart.home.set.color,0,smart.home.set.color
thay đổi màu sắc màn cửa đôi 4 phòng thu 3 tầng trệt 6 màu màu hồng,smart.home.set.color,0,smart.home.set.color,0,smart.home.set.color
tôi muốn bắt đầu của bóng hắt trợ lí cute,smart.home.set.color,True,smart.home.check.status,0,smart.home.set.color
hãy đổi phòng họp gia đình màu đỏ,smart.home.set.color,0,smart.home.set.color,0,smart.home.set.color
trợ lý béo thiết lập của bóng đứng thứ 2 sang màu màu cam ở tầng hầm 1 phòng xông hơi 3 giúp anh,smart.home.set.color,0,smart.home.set.color,0,smart.home.set.color
giúp tôi kích hoạt bóng sân màu lam,smart.home.set.color,0,smart.home.set.color,0,smart.home.set.color
bạn khởi chạy màu bóng hoa giúp mình nha,smart.home.set.color,0,smart.home.set.color,0,smart.home.set.color
đặt bóng vách 4 phòng bếp 1 sang màu xanh lá giúp tôi,smart.home.set.color,0,smart.home.set.color,0,smart.home.set.color
chuyển màn cuốn 1 sang trắng,smart.home.set.color,0,smart.home.set.color,0,smart.home.set.color
thay đổi màu của vô tuyến 1 sang màu lam ở cổng 5 tầng hầm 5,smart.home.set.color,0,smart.home.set.color,0,smart.home.set.color
bạn giúp tôi chuyển màu bóng đèn ốp trần 4 thành tím nhé,smart.home.set.color,0,smart.home.set.color,0,smart.home.set.color
command thiết bị đèn compact 2 sang tía ở hiên sau and tầng 3,smart.home.set.color,0,smart.home.set.color,0,smart.home.set.color
hãy thiết lập nhà bếp 2 xanh nước biển,smart.home.set.color,0,smart.home.set.color,0,smart.home.set.color
chỉnh quạt màu màu xanh da trời,smart.home.set.color,0,smart.home.set.color,0,smart.home.set.color
bắt đầu cái bóng học hộ bạn với,smart.home.set.color,True,smart.home.increase.level,0,smart.home.set.color
giúp tôi command loa còi 4 màu màu tím,smart.home.set.color,0,smart.home.set.color,0,smart.home.set.color
tôi muốn chỉnh của quạt thông gió thứ 1 trợ lí cute,smart.home.set.color,True,smart.home.decrease.level,0,smart.home.set.color
command quạt thông gió sáng màu violet,smart.home.set.color,0,smart.home.set.color,0,smart.home.set.color
bắt đầu đèn trang trí thứ 3 phòng đọc sách tầng 7 màu màu xanh nước biển,smart.home.set.color,0,smart.home.set.color,0,smart.home.set.color
chạy hắt trần sáng màu xám,smart.home.set.color,0,smart.home.set.color,0,smart.home.set.color
bắt đầu bóng ốp trần màu lục,smart.home.set.color,0,smart.home.set.color,0,smart.home.set.color
thay đổi màu sắc đèn rọi thứ 4 thành xám,smart.home.set.color,0,smart.home.set.color,0,smart.home.set.color
chào bạn thiết lập giúp mình màu sắc của công tắc sang màu tím với,smart.home.set.color,0,smart.home.set.color,0,smart.home.set.color
khởi chạy của rèm đơn sang màu đỏ giúp mình,smart.home.set.color,0,smart.home.set.color,0,smart.home.set.color
tôi muốn đổi màu sắc của rèm ngang 4 trợ lí cute,smart.home.set.color,0,smart.home.set.color,0,smart.home.set.color
cửa cuốn thứ 4 tía,smart.home.set.color,True,smart.home.decrease.level,0,smart.home.set.color
bạn giúp tôi chuyển màu bóng hắt tường 4 thành tím nhé,smart.home.set.color,0,smart.home.set.color,0,smart.home.set.color
hãy kích hoạt ga ra màu tía,smart.home.set.color,0,smart.home.set.color,0,smart.home.set.color
bóng thờ đỏ,smart.home.set.color,0,smart.home.set.color,0,smart.home.set.color
em ơi có thể thay tvs 1 sang xám không,smart.home.set.color,0,smart.home.set.color,0,smart.home.set.color
thiết lập quạt trần phòng sinh hoạt chung 3 tầng thượng 8 sang màu lục,smart.home.set.color,0,smart.home.set.color,0,smart.home.set.color
bật đèn quảng cáo sáng màu hồng,smart.home.set.color,0,smart.home.set.color,0,smart.home.set.color
bạn giúp mình command màu rèm đơn nhé,smart.home.set.color,0,smart.home.set.color,0,smart.home.set.color
đổi màu nút ấn 2 phòng ăn tối 3 thành lam,smart.home.set.color,0,smart.home.set.color,0,smart.home.set.color
thiết lập đèn màu sắc 2 phòng bố mẹ sang màu xám giúp tôi,smart.home.set.color,0,smart.home.set.color,0,smart.home.set.color
